{
  "$schema": "../../../schema/query.schema.json",
  "id": "FSQ-HUNT-001",
  "slug": "potential-sql-injection-indicator-matches",
  "title": {
    "en": "Potential SQL Injection Indicator Matches in External Event Messages",
    "id": "Kecocokan Indikator Potensi SQL Injection pada Pesan Event Eksternal",
    "source": "ai-assisted",
    "reviewed_by_maintainer": true
  },
  "origin": {
    "kind": "original-work",
    "author": "Rungga",
    "third_party_code_included": false
  },
  "platform": "FortiSIEM",
  "query_type": "advanced-search",
  "dialect": "ClickHouse SQL",
  "category": "threat-hunting",
  "scope": "single-customer",
  "summary": "Finds external event messages containing case-insensitive substrings associated with possible SQL injection activity for analyst triage.",
  "parameters": [
    {
      "name": "PERIOD_START",
      "type": "datetime-string",
      "description": "Inclusive start of the observation period."
    },
    {
      "name": "PERIOD_END",
      "type": "datetime-string",
      "description": "Exclusive end of the observation period."
    },
    {
      "name": "TIMEZONE",
      "type": "iana-timezone-string",
      "description": "IANA timezone used to interpret both period boundaries."
    },
    {
      "name": "CUSTOMER_NAME",
      "type": "string",
      "description": "Organization value used by the target FortiSIEM deployment."
    }
  ],
  "privacy": {
    "status": "sanitized",
    "reviewed_on": "2026-08-11",
    "removed_categories": [
      "organization-name",
      "customer-name",
      "operational-time-range",
      "timezone",
      "raw-event-content"
    ]
  },
  "compatibility": {
    "documentation_reference_version": "7.5.1",
    "tested_versions": [],
    "execution_validation": "not-independently-executed"
  },
  "references": [
    {
      "title": "Creating a New Advanced Search",
      "publisher": "Fortinet",
      "url": "https://docs.fortinet.com/document/fortisiem/7.5.1/user-guide/431900/creating-a-new-advanced-search",
      "accessed_on": "2026-08-11"
    },
    {
      "title": "FortiSIEM Event Categories and Handling",
      "publisher": "Fortinet",
      "url": "https://docs.fortinet.com/document/fortisiem/7.5.1/user-guide/604340/fortisiem-event-categories-and-handling",
      "accessed_on": "2026-08-11"
    },
    {
      "title": "Working with Event Attributes",
      "publisher": "Fortinet",
      "url": "https://docs.fortinet.com/document/fortisiem/7.5.1/user-guide/042752/working-with-event-attributes",
      "accessed_on": "2026-08-11"
    },
    {
      "title": "Functions for Searching in Strings",
      "publisher": "ClickHouse",
      "url": "https://clickhouse.com/docs/sql-reference/functions/string-search-functions",
      "accessed_on": "2026-08-11"
    },
    {
      "title": "SQL Injection",
      "publisher": "OWASP Foundation",
      "url": "https://owasp.org/www-community/attacks/SQL_Injection",
      "accessed_on": "2026-08-11"
    }
  ],
  "license": "MIT"
}